{
    "id": 1,
    "name": "サンプル商品",
    "code": "SAMPLE-001",
    "note": "サンプルnoteの説明文です。",
    "description_list": "サンプルdescription_listの説明文です。",
    "description_detail": null,
    "search_word": "サンプルsearch_wordの説明文です。",
    "free_area": null,
    "create_date": "2024-01-01T00:00:00+09:00",
    "update_date": "2024-01-01T00:00:00+09:00",
    "product_categorys": [
        {
            "id": 1,
            "name": "サンプルProductCategory"
        }
    ],
    "product_class": [
        {
            "id": 1,
            "name": "サンプルProductClass"
        }
    ],
    "product_images": [
        {
            "id": 1,
            "name": "サンプルProductImage"
        }
    ],
    "product_tags": [
        {
            "id": 1,
            "name": "サンプルProductTag"
        }
    ],
    "customer_favorite_products": [
        {
            "id": 1,
            "name": "サンプルCustomerFavoriteProduct"
        }
    ],
    "member": {
        "id": 1,
        "name": "サンプルMember"
    },
    "product_status": {
        "id": 1,
        "name": "サンプルProductStatus"
    }
}